{
  "session_id": "430ee73d",
  "last_input": "help me hire a designer",
  "last_output": {
    "clarifications_asked": [],
    "jd_drafts": [
      {
        "title": "Design Lead",
        "summary": "Join our fast-paced and growth-minded startup as we revolutionize the industry with innovative design solutions! As our Design Lead, you'll be responsible for shaping the visual identity of our brand and products. If you're passionate about creating impactful designs that drive user engagement, let's talk!",
        "responsibilities": [
          "Develop and maintain a consistent visual language across all our platforms",
          "Lead cross-functional design efforts to create engaging and intuitive product experiences",
          "Collaborate with the product team to define product requirements and ensure design solutions meet business goals",
          "Create and manage design systems, style guides, and component libraries to streamline workflows",
          "Conduct user research and analyze data to inform design decisions and drive business outcomes",
          "Mentor and lead junior designers to foster growth and innovation within the team",
          "Stay up-to-date with industry trends and best practices to continuously improve our design processes"
        ],
        "requirements": [
          "5+ years of experience in graphic design, UI/UX design, or a related field",
          "Proven track record of creating visually stunning and user-centered designs",
          "Proficiency in Adobe Creative Suite (Photoshop, Illustrator, Sketch, etc.)",
          "Strong understanding of design systems, human-centered design principles, and UX methodologies",
          "Excellent communication and project management skills to lead cross-functional teams",
          "Experience with design tools like Figma, InVision, or other collaborative platforms",
          "Bachelors' degree in Design or a related field; advanced degree a plus"
        ],
        "compensation_note": "$100k-$150k plus equity package with startup benefits (health, dental, unlimited PTO)"
      },
      {
        "title": "Senior Designer",
        "summary": "Join our fast-paced startup as a Senior Designer, where you'll have the opportunity to drive visual innovation and shape the user experience of our products. With a passion for design excellence and a growth-minded attitude, you'll be part of a collaborative team that's dedicated to making a lasting impact.",
        "responsibilities": [
          "Develop high-fidelity designs that align with our brand vision and user-centric approach",
          "Collaborate closely with cross-functional teams to drive product decisions and iterate on design solutions",
          "Create and maintain design systems, style guides, and documentation to ensure consistency across products",
          "Conduct user research and testing to inform design decisions and measure the effectiveness of design solutions",
          "Develop and manage design projects from concept to launch, meeting tight deadlines and delivering high-quality results",
          "Stay up-to-date with industry trends and best practices in UI/UX design, and apply this knowledge to drive innovation within our team",
          "Mentor junior designers and contribute to the growth and development of our design team"
        ],
        "requirements": [
          "5+ years of experience in graphic and UI/UX design, with a strong portfolio that showcases your expertise",
          "Proficiency in Adobe Creative Suite (Photoshop, Illustrator, Sketch, Figma, etc.) and ability to learn new tools quickly",
          "Strong understanding of user-centered design principles and human-computer interaction",
          "Excellent communication and collaboration skills, with the ability to work effectively with cross-functional teams",
          "Experience with design systems, style guides, and documentation is a plus",
          "A growth-minded attitude and passion for continuous learning and self-improvement",
          "Ability to work independently and manage multiple projects simultaneously"
        ],
        "compensation_note": "$100k-$150k plus equity package with startup benefits (health, dental, unlimited PTO)"
      },
      {
        "title": "Junior Graphic Designer",
        "summary": "Join our dynamic team as a Junior Graphic Designer and contribute to creating visually stunning experiences that drive real impact. You'll have the opportunity to work on high-profile projects, collaborate with a talented group of creatives, and grow your skills in a fast-paced environment.",
        "responsibilities": [
          "Develop innovative UI/UX design solutions that meet our brand's unique needs",
          "Collaborate with cross-functional teams to ensure design consistency across all touchpoints",
          "Create high-quality visual assets (e.g., logos, icons, graphics) using Adobe Creative Suite",
          "Design and develop interactive prototypes to test new ideas and concepts",
          "Stay up-to-date on industry trends and best practices in graphic design and UI/UX",
          "Contribute to the development of our brand's visual identity and messaging",
          "Work closely with our marketing team to create engaging campaigns and materials",
          "Help drive design decisions that align with our company's mission and values"
        ],
        "requirements": [
          "2+ years of experience in graphic design, UI/UX design, or a related field",
          "Proficiency in Adobe Creative Suite (Photoshop, Illustrator, InDesign, Sketch)",
          "Strong portfolio showcasing your design skills and experience",
          "Excellent communication and collaboration skills",
          "Ability to work independently and as part of a remote team",
          "Familiarity with design systems and principles",
          "Experience with UI/UX design tools like Figma or Adobe XD is a plus"
        ],
        "compensation_note": "$100k-$150k plus equity package with startup benefits (health, dental, unlimited PTO)"
      }
    ],
    "hiring_plan": {
      "steps": [
        "Weeks 1-2: Sourcing & Initial Screening - Utilize social media, online communities, and job boards to attract top talent. Conduct initial phone screenings to assess candidate fit and basic qualifications.",
        "Weeks 3-4: Async Video Screening & Skills Assessments - Use async video screening tools to evaluate communication skills and company culture fit. Send relevant design challenges or skills assessments to shortlisted candidates to gauge their technical abilities.",
        "Weeks 5-6: In-Person Interviews (Design Lead, Senior Designer) & Remote Interview (Junior Graphic Designer) - Conduct in-person interviews for Design Lead and Senior Designer roles. Schedule remote interview for Junior Graphic Designer role due to startup constraints.",
        "Weeks 7-8: Reference Checks & Offer Extension - Perform thorough reference checks for top candidates. Prepare and extend job offers to selected candidates, ensuring competitive compensation packages.",
        "Final Week: Onboarding Process Initiation - Coordinate with successful candidates on onboarding logistics, including paperwork, benefits, and team introductions."
      ],
      "owners": [
        "Hiring Manager",
        "Recruiter/HR",
        "Team Lead (Design)",
        "CEO/Hiring Committee",
        "Onboarding Specialist"
      ],
      "timeline_weeks": 8
    },
    "raw_markdown": "# Hiring Plan Report\n## Executive Summary\nThis hiring plan outlines the process to recruit **Design Lead, Senior Designer, Junior Graphic Designer**. The target timeline is **8 week(s)**. The plan includes sourcing, screening, assessment, interviews, and onboarding.\n\n## Job Descriptions\n### Design Lead\n#### Summary\nJoin our fast-paced and growth-minded startup as we revolutionize the industry with innovative design solutions! As our Design Lead, you'll be responsible for shaping the visual identity of our brand and products. If you're passionate about creating impactful designs that drive user engagement, let's talk!\n#### Key Responsibilities\n- Develop and maintain a consistent visual language across all our platforms\n- Lead cross-functional design efforts to create engaging and intuitive product experiences\n- Collaborate with the product team to define product requirements and ensure design solutions meet business goals\n- Create and manage design systems, style guides, and component libraries to streamline workflows\n- Conduct user research and analyze data to inform design decisions and drive business outcomes\n- Mentor and lead junior designers to foster growth and innovation within the team\n- Stay up-to-date with industry trends and best practices to continuously improve our design processes\n#### Requirements\n- 5+ years of experience in graphic design, UI/UX design, or a related field\n- Proven track record of creating visually stunning and user-centered designs\n- Proficiency in Adobe Creative Suite (Photoshop, Illustrator, Sketch, etc.)\n- Strong understanding of design systems, human-centered design principles, and UX methodologies\n- Excellent communication and project management skills to lead cross-functional teams\n- Experience with design tools like Figma, InVision, or other collaborative platforms\n- Bachelors' degree in Design or a related field; advanced degree a plus\n**Compensation:** $100k-$150k plus equity package with startup benefits (health, dental, unlimited PTO)\n\n### Senior Designer\n#### Summary\nJoin our fast-paced startup as a Senior Designer, where you'll have the opportunity to drive visual innovation and shape the user experience of our products. With a passion for design excellence and a growth-minded attitude, you'll be part of a collaborative team that's dedicated to making a lasting impact.\n#### Key Responsibilities\n- Develop high-fidelity designs that align with our brand vision and user-centric approach\n- Collaborate closely with cross-functional teams to drive product decisions and iterate on design solutions\n- Create and maintain design systems, style guides, and documentation to ensure consistency across products\n- Conduct user research and testing to inform design decisions and measure the effectiveness of design solutions\n- Develop and manage design projects from concept to launch, meeting tight deadlines and delivering high-quality results\n- Stay up-to-date with industry trends and best practices in UI/UX design, and apply this knowledge to drive innovation within our team\n- Mentor junior designers and contribute to the growth and development of our design team\n#### Requirements\n- 5+ years of experience in graphic and UI/UX design, with a strong portfolio that showcases your expertise\n- Proficiency in Adobe Creative Suite (Photoshop, Illustrator, Sketch, Figma, etc.) and ability to learn new tools quickly\n- Strong understanding of user-centered design principles and human-computer interaction\n- Excellent communication and collaboration skills, with the ability to work effectively with cross-functional teams\n- Experience with design systems, style guides, and documentation is a plus\n- A growth-minded attitude and passion for continuous learning and self-improvement\n- Ability to work independently and manage multiple projects simultaneously\n**Compensation:** $100k-$150k plus equity package with startup benefits (health, dental, unlimited PTO)\n\n### Junior Graphic Designer\n#### Summary\nJoin our dynamic team as a Junior Graphic Designer and contribute to creating visually stunning experiences that drive real impact. You'll have the opportunity to work on high-profile projects, collaborate with a talented group of creatives, and grow your skills in a fast-paced environment.\n#### Key Responsibilities\n- Develop innovative UI/UX design solutions that meet our brand's unique needs\n- Collaborate with cross-functional teams to ensure design consistency across all touchpoints\n- Create high-quality visual assets (e.g., logos, icons, graphics) using Adobe Creative Suite\n- Design and develop interactive prototypes to test new ideas and concepts\n- Stay up-to-date on industry trends and best practices in graphic design and UI/UX\n- Contribute to the development of our brand's visual identity and messaging\n- Work closely with our marketing team to create engaging campaigns and materials\n- Help drive design decisions that align with our company's mission and values\n#### Requirements\n- 2+ years of experience in graphic design, UI/UX design, or a related field\n- Proficiency in Adobe Creative Suite (Photoshop, Illustrator, InDesign, Sketch)\n- Strong portfolio showcasing your design skills and experience\n- Excellent communication and collaboration skills\n- Ability to work independently and as part of a remote team\n- Familiarity with design systems and principles\n- Experience with UI/UX design tools like Figma or Adobe XD is a plus\n**Compensation:** $100k-$150k plus equity package with startup benefits (health, dental, unlimited PTO)\n\n\n## Hiring Process Plan\n**Timeline:** 8 weeks\n**Process Steps:**\n1. Weeks 1-2: Sourcing & Initial Screening - Utilize social media, online communities, and job boards to attract top talent. Conduct initial phone screenings to assess candidate fit and basic qualifications.  \n   *Owner: Hiring Manager*\n2. Weeks 3-4: Async Video Screening & Skills Assessments - Use async video screening tools to evaluate communication skills and company culture fit. Send relevant design challenges or skills assessments to shortlisted candidates to gauge their technical abilities.  \n   *Owner: Recruiter/HR*\n3. Weeks 5-6: In-Person Interviews (Design Lead, Senior Designer) & Remote Interview (Junior Graphic Designer) - Conduct in-person interviews for Design Lead and Senior Designer roles. Schedule remote interview for Junior Graphic Designer role due to startup constraints.  \n   *Owner: Team Lead (Design)*\n4. Weeks 7-8: Reference Checks & Offer Extension - Perform thorough reference checks for top candidates. Prepare and extend job offers to selected candidates, ensuring competitive compensation packages.  \n   *Owner: CEO/Hiring Committee*\n5. Final Week: Onboarding Process Initiation - Coordinate with successful candidates on onboarding logistics, including paperwork, benefits, and team introductions.  \n   *Owner: Onboarding Specialist*\n\n## Interview Kit\n**Screening Questions:**\n- Can you walk me through a recent project where you applied Graphic Design, UI/UX Design, Adobe Creative Suite? What was your specific impact?\n- How do you measure success in this role, and what metrics did you move recently?\n- Describe a challenging problem you solved using Graphic Design. What trade-offs did you consider?\n- What does good code/analysis quality look like to you, and how do you ensure it under deadlines?\n- Tell me about a time you collaborated cross-functionally. How did you handle misalignment?\n**Evaluation Rubric:**\n- Technical depth\n- Problem solving\n- Communication\n- Ownership & initiative\n- Collaboration & culture add\n**Scorecard Fields:**\n- Technical Depth (1-5)\n- Problem Solving (1-5)\n- Communication (1-5)\n- Culture Add (1-5)\n- Overall Recommendation\n- Notes\n\n## Next Steps\n- Share this plan with stakeholders for alignment.\n- Start sourcing and schedule initial screens.\n- Prepare assessments and interview materials.",
    "raw_json": {
      "extraction": {
        "company_stage": "startup",
        "timeline_weeks": 8,
        "budget_range": "$60,000 - $80,000 per year",
        "seniority": "mid",
        "employment_type": "full-time",
        "location": "Remote or New York City",
        "key_skills": [
          "Graphic Design",
          "UI/UX Design",
          "Adobe Creative Suite"
        ],
        "roles": [
          "Design Lead",
          "Senior Designer",
          "Junior Graphic Designer"
        ]
      },
      "job_descriptions": [
        {
          "title": "Design Lead",
          "summary": "Join our fast-paced and growth-minded startup as we revolutionize the industry with innovative design solutions! As our Design Lead, you'll be responsible for shaping the visual identity of our brand and products. If you're passionate about creating impactful designs that drive user engagement, let's talk!",
          "responsibilities": [
            "Develop and maintain a consistent visual language across all our platforms",
            "Lead cross-functional design efforts to create engaging and intuitive product experiences",
            "Collaborate with the product team to define product requirements and ensure design solutions meet business goals",
            "Create and manage design systems, style guides, and component libraries to streamline workflows",
            "Conduct user research and analyze data to inform design decisions and drive business outcomes",
            "Mentor and lead junior designers to foster growth and innovation within the team",
            "Stay up-to-date with industry trends and best practices to continuously improve our design processes"
          ],
          "requirements": [
            "5+ years of experience in graphic design, UI/UX design, or a related field",
            "Proven track record of creating visually stunning and user-centered designs",
            "Proficiency in Adobe Creative Suite (Photoshop, Illustrator, Sketch, etc.)",
            "Strong understanding of design systems, human-centered design principles, and UX methodologies",
            "Excellent communication and project management skills to lead cross-functional teams",
            "Experience with design tools like Figma, InVision, or other collaborative platforms",
            "Bachelors' degree in Design or a related field; advanced degree a plus"
          ],
          "compensation_note": "$100k-$150k plus equity package with startup benefits (health, dental, unlimited PTO)"
        },
        {
          "title": "Senior Designer",
          "summary": "Join our fast-paced startup as a Senior Designer, where you'll have the opportunity to drive visual innovation and shape the user experience of our products. With a passion for design excellence and a growth-minded attitude, you'll be part of a collaborative team that's dedicated to making a lasting impact.",
          "responsibilities": [
            "Develop high-fidelity designs that align with our brand vision and user-centric approach",
            "Collaborate closely with cross-functional teams to drive product decisions and iterate on design solutions",
            "Create and maintain design systems, style guides, and documentation to ensure consistency across products",
            "Conduct user research and testing to inform design decisions and measure the effectiveness of design solutions",
            "Develop and manage design projects from concept to launch, meeting tight deadlines and delivering high-quality results",
            "Stay up-to-date with industry trends and best practices in UI/UX design, and apply this knowledge to drive innovation within our team",
            "Mentor junior designers and contribute to the growth and development of our design team"
          ],
          "requirements": [
            "5+ years of experience in graphic and UI/UX design, with a strong portfolio that showcases your expertise",
            "Proficiency in Adobe Creative Suite (Photoshop, Illustrator, Sketch, Figma, etc.) and ability to learn new tools quickly",
            "Strong understanding of user-centered design principles and human-computer interaction",
            "Excellent communication and collaboration skills, with the ability to work effectively with cross-functional teams",
            "Experience with design systems, style guides, and documentation is a plus",
            "A growth-minded attitude and passion for continuous learning and self-improvement",
            "Ability to work independently and manage multiple projects simultaneously"
          ],
          "compensation_note": "$100k-$150k plus equity package with startup benefits (health, dental, unlimited PTO)"
        },
        {
          "title": "Junior Graphic Designer",
          "summary": "Join our dynamic team as a Junior Graphic Designer and contribute to creating visually stunning experiences that drive real impact. You'll have the opportunity to work on high-profile projects, collaborate with a talented group of creatives, and grow your skills in a fast-paced environment.",
          "responsibilities": [
            "Develop innovative UI/UX design solutions that meet our brand's unique needs",
            "Collaborate with cross-functional teams to ensure design consistency across all touchpoints",
            "Create high-quality visual assets (e.g., logos, icons, graphics) using Adobe Creative Suite",
            "Design and develop interactive prototypes to test new ideas and concepts",
            "Stay up-to-date on industry trends and best practices in graphic design and UI/UX",
            "Contribute to the development of our brand's visual identity and messaging",
            "Work closely with our marketing team to create engaging campaigns and materials",
            "Help drive design decisions that align with our company's mission and values"
          ],
          "requirements": [
            "2+ years of experience in graphic design, UI/UX design, or a related field",
            "Proficiency in Adobe Creative Suite (Photoshop, Illustrator, InDesign, Sketch)",
            "Strong portfolio showcasing your design skills and experience",
            "Excellent communication and collaboration skills",
            "Ability to work independently and as part of a remote team",
            "Familiarity with design systems and principles",
            "Experience with UI/UX design tools like Figma or Adobe XD is a plus"
          ],
          "compensation_note": "$100k-$150k plus equity package with startup benefits (health, dental, unlimited PTO)"
        }
      ],
      "hiring_plan": {
        "steps": [
          "Weeks 1-2: Sourcing & Initial Screening - Utilize social media, online communities, and job boards to attract top talent. Conduct initial phone screenings to assess candidate fit and basic qualifications.",
          "Weeks 3-4: Async Video Screening & Skills Assessments - Use async video screening tools to evaluate communication skills and company culture fit. Send relevant design challenges or skills assessments to shortlisted candidates to gauge their technical abilities.",
          "Weeks 5-6: In-Person Interviews (Design Lead, Senior Designer) & Remote Interview (Junior Graphic Designer) - Conduct in-person interviews for Design Lead and Senior Designer roles. Schedule remote interview for Junior Graphic Designer role due to startup constraints.",
          "Weeks 7-8: Reference Checks & Offer Extension - Perform thorough reference checks for top candidates. Prepare and extend job offers to selected candidates, ensuring competitive compensation packages.",
          "Final Week: Onboarding Process Initiation - Coordinate with successful candidates on onboarding logistics, including paperwork, benefits, and team introductions."
        ],
        "owners": [
          "Hiring Manager",
          "Recruiter/HR",
          "Team Lead (Design)",
          "CEO/Hiring Committee",
          "Onboarding Specialist"
        ],
        "timeline_weeks": 8
      },
      "interview_kit": {
        "screening_questions": [
          "Can you walk me through a recent project where you applied Graphic Design, UI/UX Design, Adobe Creative Suite? What was your specific impact?",
          "How do you measure success in this role, and what metrics did you move recently?",
          "Describe a challenging problem you solved using Graphic Design. What trade-offs did you consider?",
          "What does good code/analysis quality look like to you, and how do you ensure it under deadlines?",
          "Tell me about a time you collaborated cross-functionally. How did you handle misalignment?"
        ],
        "screening_guide": [
          {
            "question": "Describe a recent project and your specific impact.",
            "what_to_evaluate": "Clarity, ownership, measurable outcomes"
          },
          {
            "question": "Walk me through a tough technical decision.",
            "what_to_evaluate": "Trade-offs, reasoning, stakeholder alignment"
          }
        ],
        "evaluation_rubric": [
          "Technical depth",
          "Problem solving",
          "Communication",
          "Ownership & initiative",
          "Collaboration & culture add"
        ],
        "scorecard": [
          "Technical Depth (1-5)",
          "Problem Solving (1-5)",
          "Communication (1-5)",
          "Culture Add (1-5)",
          "Overall Recommendation",
          "Notes"
        ],
        "outreach_subject": "",
        "outreach_body": ""
      },
      "clarifications_asked": [],
      "timestamp": "generated"
    }
  },
  "extraction": null,
  "timestamp": "2025-09-11T15:37:39.291724"
}