{
  "session_id": "88fb4518",
  "last_input": "help me hire a software engineer",
  "last_output": {
    "clarifications_asked": [],
    "jd_drafts": [
      {
        "title": "Software Engineer",
        "summary": "Join our high-growth startup as a mid-level Software Engineer to build scalable, user-friendly products that drive real business impact. You'll work closely with our cross-functional team to design and develop software solutions that make a difference in the lives of millions. If you're passionate about coding, collaboration, and innovation, this is your dream role!",
        "responsibilities": [
          "Design and implement high-quality software components using JavaScript and Python",
          "Collaborate with our product and design teams to define product requirements and develop technical solutions",
          "Develop and maintain scalable, efficient codebases that meet the needs of our growing user base",
          "Contribute to the development of new features and products, working closely with our engineering team",
          "Participate in code reviews, providing feedback and guidance to junior engineers",
          "Troubleshoot complex technical issues and provide solutions to ensure seamless product performance",
          "Stay up-to-date with industry trends and emerging technologies, applying this knowledge to drive innovation within the company"
        ],
        "requirements": [
          "3+ years of experience as a Software Engineer, preferably in a fast-paced startup environment",
          "Strong proficiency in JavaScript (ES6+) and Python, with experience using frameworks such as React or Node.js",
          "Experience working with cloud-based technologies, such as AWS or Google Cloud Platform",
          "Familiarity with containerization tools like Docker and Kubernetes",
          "Knowledge of agile development methodologies, such as Scrum or Kanban",
          "Excellent communication and collaboration skills, with the ability to work effectively in a remote team",
          "Experience with testing frameworks (e.g. Jest, Pytest) and continuous integration/continuous deployment (CI/CD) pipelines"
        ],
        "compensation_note": "$80k-$120k plus equity package with startup benefits (health, dental, unlimited PTO)"
      }
    ],
    "hiring_plan": {
      "steps": [
        "Weeks 1-2: **Sourcing** - Utilize social media, online communities, and job boards to attract top talent (Hiring Manager & HR)",
        "Weeks 3-4: **Async Video Screening** - Conduct initial video screenings to assess candidate fit and technical skills (Team Lead)",
        "Weeks 5-6: **Skills Assessments & Interviews** - Invite top candidates for in-person interviews, coding challenges, or skills assessments to evaluate technical abilities (Hiring Manager & Team Lead)",
        "Week 7: **Reference Checks** - Verify candidate references to ensure a good fit for our fast-paced startup environment (CEO)",
        "Week 8: **Offer Extension & Onboarding Planning** - Prepare and extend job offers to selected candidates, plan onboarding process (HR)"
      ],
      "owners": [
        "Hiring Manager",
        "Team Lead",
        "Hiring Manager & Team Lead",
        "CEO",
        "HR"
      ],
      "timeline_weeks": 8
    },
    "raw_markdown": "# Hiring Plan Report\n## Executive Summary\nThis hiring plan outlines the process to recruit **Software Engineer**. The target timeline is **8 week(s)**. The plan includes sourcing, screening, assessment, interviews, and onboarding.\n\n## Job Descriptions\n### Software Engineer\n#### Summary\nJoin our high-growth startup as a mid-level Software Engineer to build scalable, user-friendly products that drive real business impact. You'll work closely with our cross-functional team to design and develop software solutions that make a difference in the lives of millions. If you're passionate about coding, collaboration, and innovation, this is your dream role!\n#### Key Responsibilities\n- Design and implement high-quality software components using JavaScript and Python\n- Collaborate with our product and design teams to define product requirements and develop technical solutions\n- Develop and maintain scalable, efficient codebases that meet the needs of our growing user base\n- Contribute to the development of new features and products, working closely with our engineering team\n- Participate in code reviews, providing feedback and guidance to junior engineers\n- Troubleshoot complex technical issues and provide solutions to ensure seamless product performance\n- Stay up-to-date with industry trends and emerging technologies, applying this knowledge to drive innovation within the company\n#### Requirements\n- 3+ years of experience as a Software Engineer, preferably in a fast-paced startup environment\n- Strong proficiency in JavaScript (ES6+) and Python, with experience using frameworks such as React or Node.js\n- Experience working with cloud-based technologies, such as AWS or Google Cloud Platform\n- Familiarity with containerization tools like Docker and Kubernetes\n- Knowledge of agile development methodologies, such as Scrum or Kanban\n- Excellent communication and collaboration skills, with the ability to work effectively in a remote team\n- Experience with testing frameworks (e.g. Jest, Pytest) and continuous integration/continuous deployment (CI/CD) pipelines\n**Compensation:** $80k-$120k plus equity package with startup benefits (health, dental, unlimited PTO)\n\n\n## Hiring Process Plan\n**Timeline:** 8 weeks\n**Process Steps:**\n1. Weeks 1-2: **Sourcing** - Utilize social media, online communities, and job boards to attract top talent (Hiring Manager & HR)  \n   *Owner: Hiring Manager*\n2. Weeks 3-4: **Async Video Screening** - Conduct initial video screenings to assess candidate fit and technical skills (Team Lead)  \n   *Owner: Team Lead*\n3. Weeks 5-6: **Skills Assessments & Interviews** - Invite top candidates for in-person interviews, coding challenges, or skills assessments to evaluate technical abilities (Hiring Manager & Team Lead)  \n   *Owner: Hiring Manager & Team Lead*\n4. Week 7: **Reference Checks** - Verify candidate references to ensure a good fit for our fast-paced startup environment (CEO)  \n   *Owner: CEO*\n5. Week 8: **Offer Extension & Onboarding Planning** - Prepare and extend job offers to selected candidates, plan onboarding process (HR)  \n   *Owner: HR*\n\n## Interview Kit\n**Screening Questions:**\n- Can you walk me through a recent project where you applied software engineer, javascript, python? What was your specific impact?\n- How do you measure success in this role, and what metrics did you move recently?\n- Describe a challenging problem you solved using software engineer. What trade-offs did you consider?\n- What does good code/analysis quality look like to you, and how do you ensure it under deadlines?\n- Tell me about a time you collaborated cross-functionally. How did you handle misalignment?\n**Evaluation Rubric:**\n- Technical depth\n- Problem solving\n- Communication\n- Ownership & initiative\n- Collaboration & culture add\n**Scorecard Fields:**\n- Technical Depth (1-5)\n- Problem Solving (1-5)\n- Communication (1-5)\n- Culture Add (1-5)\n- Overall Recommendation\n- Notes\n\n## Next Steps\n- Share this plan with stakeholders for alignment.\n- Start sourcing and schedule initial screens.\n- Prepare assessments and interview materials.",
    "raw_json": {
      "extraction": {
        "company_stage": "startup",
        "timeline_weeks": 8,
        "budget_range": "competitive",
        "seniority": "mid",
        "employment_type": "full-time",
        "location": "remote",
        "key_skills": [
          "software engineer",
          "javascript",
          "python"
        ],
        "roles": [
          "Software Engineer"
        ]
      },
      "job_descriptions": [
        {
          "title": "Software Engineer",
          "summary": "Join our high-growth startup as a mid-level Software Engineer to build scalable, user-friendly products that drive real business impact. You'll work closely with our cross-functional team to design and develop software solutions that make a difference in the lives of millions. If you're passionate about coding, collaboration, and innovation, this is your dream role!",
          "responsibilities": [
            "Design and implement high-quality software components using JavaScript and Python",
            "Collaborate with our product and design teams to define product requirements and develop technical solutions",
            "Develop and maintain scalable, efficient codebases that meet the needs of our growing user base",
            "Contribute to the development of new features and products, working closely with our engineering team",
            "Participate in code reviews, providing feedback and guidance to junior engineers",
            "Troubleshoot complex technical issues and provide solutions to ensure seamless product performance",
            "Stay up-to-date with industry trends and emerging technologies, applying this knowledge to drive innovation within the company"
          ],
          "requirements": [
            "3+ years of experience as a Software Engineer, preferably in a fast-paced startup environment",
            "Strong proficiency in JavaScript (ES6+) and Python, with experience using frameworks such as React or Node.js",
            "Experience working with cloud-based technologies, such as AWS or Google Cloud Platform",
            "Familiarity with containerization tools like Docker and Kubernetes",
            "Knowledge of agile development methodologies, such as Scrum or Kanban",
            "Excellent communication and collaboration skills, with the ability to work effectively in a remote team",
            "Experience with testing frameworks (e.g. Jest, Pytest) and continuous integration/continuous deployment (CI/CD) pipelines"
          ],
          "compensation_note": "$80k-$120k plus equity package with startup benefits (health, dental, unlimited PTO)"
        }
      ],
      "hiring_plan": {
        "steps": [
          "Weeks 1-2: **Sourcing** - Utilize social media, online communities, and job boards to attract top talent (Hiring Manager & HR)",
          "Weeks 3-4: **Async Video Screening** - Conduct initial video screenings to assess candidate fit and technical skills (Team Lead)",
          "Weeks 5-6: **Skills Assessments & Interviews** - Invite top candidates for in-person interviews, coding challenges, or skills assessments to evaluate technical abilities (Hiring Manager & Team Lead)",
          "Week 7: **Reference Checks** - Verify candidate references to ensure a good fit for our fast-paced startup environment (CEO)",
          "Week 8: **Offer Extension & Onboarding Planning** - Prepare and extend job offers to selected candidates, plan onboarding process (HR)"
        ],
        "owners": [
          "Hiring Manager",
          "Team Lead",
          "Hiring Manager & Team Lead",
          "CEO",
          "HR"
        ],
        "timeline_weeks": 8
      },
      "interview_kit": {
        "screening_questions": [
          "Can you walk me through a recent project where you applied software engineer, javascript, python? What was your specific impact?",
          "How do you measure success in this role, and what metrics did you move recently?",
          "Describe a challenging problem you solved using software engineer. What trade-offs did you consider?",
          "What does good code/analysis quality look like to you, and how do you ensure it under deadlines?",
          "Tell me about a time you collaborated cross-functionally. How did you handle misalignment?"
        ],
        "screening_guide": [
          {
            "question": "Describe a recent project and your specific impact.",
            "what_to_evaluate": "Clarity, ownership, measurable outcomes"
          },
          {
            "question": "Walk me through a tough technical decision.",
            "what_to_evaluate": "Trade-offs, reasoning, stakeholder alignment"
          }
        ],
        "evaluation_rubric": [
          "Technical depth",
          "Problem solving",
          "Communication",
          "Ownership & initiative",
          "Collaboration & culture add"
        ],
        "scorecard": [
          "Technical Depth (1-5)",
          "Problem Solving (1-5)",
          "Communication (1-5)",
          "Culture Add (1-5)",
          "Overall Recommendation",
          "Notes"
        ],
        "outreach_subject": "",
        "outreach_body": ""
      },
      "clarifications_asked": [],
      "timestamp": "generated"
    }
  },
  "extraction": null,
  "timestamp": "2025-09-10T21:43:28.116070"
}