{
  "session_id": "9e021f41",
  "last_input": "screening questions",
  "last_output": {
    "clarifications_asked": [],
    "jd_drafts": [
      {
        "title": "Data Analyst",
        "summary": "Join our fast-paced startup as a Data Analyst and drive business growth through data-driven insights! As a key member of our analytics team, you'll help us make informed decisions, optimize operations, and fuel innovation. If you're passionate about using data to tell stories, we want to hear from you!",
        "responsibilities": [
          "Develop and maintain complex SQL queries to extract valuable insights from large datasets",
          "Design and implement data visualizations using Python and BI tools like Tableau or Power BI",
          "Create A/B testing frameworks to measure the impact of product changes on customer behavior",
          "Collaborate with cross-functional teams to identify business opportunities and drive strategic decision-making",
          "Develop and maintain dashboards to track key performance indicators (KPIs) and metrics",
          "Analyze and interpret data to inform product development, marketing strategies, and operational improvements",
          "Communicate complex data insights and recommendations to non-technical stakeholders through clear, actionable reporting",
          "Stay up-to-date with industry trends and emerging technologies in data analysis and visualization"
        ],
        "requirements": [
          "3+ years of experience as a Data Analyst or similar role",
          "Mastery of SQL, Python programming skills, and proficiency in BI tools like Tableau or Power BI",
          "Experience with A/B testing frameworks and statistical analysis techniques",
          "Strong communication and collaboration skills to work effectively with cross-functional teams",
          "Ability to prioritize multiple projects and meet deadlines in a fast-paced environment",
          "Familiarity with cloud-based data platforms (e.g. AWS, Google Cloud) and big data technologies",
          "Bachelor's degree in Computer Science, Statistics, Mathematics, or related field",
          "Experience working with large datasets and implementing data governance best practices"
        ],
        "compensation_note": "$80k-$120k plus equity package with startup benefits (health, dental, unlimited PTO)"
      }
    ],
    "hiring_plan": {
      "steps": [
        "Week 1: Sourcing - Utilize social media, employee referrals, and job boards to attract top talent.",
        "Week 2: Async Video Screening - Conduct initial video screenings using a platform like HireVue or Loom to filter candidates.",
        "Week 3: Skills Assessments - Develop and send skills assessments tailored to the Data Analyst role to gauge technical abilities.",
        "Week 4: Phone Interviews (Hiring Manager & Team Lead) - Shortlist top candidates for in-depth phone interviews with the Hiring Manager and Team Lead.",
        "Week 5: In-Person Interviews - Invite top candidates for in-person interviews at the office, including a presentation task.",
        "Week 6-7: Reference Checks & Offer Extension - Conduct thorough reference checks and extend offers to selected candidates.",
        "Week 8: Onboarding - Finalize onboarding process, ensure all necessary paperwork is complete, and coordinate with IT for equipment setup."
      ],
      "owners": [
        "Hiring Manager",
        "HR (Recruiting Specialist)",
        "Team Lead",
        "CEO",
        "Hiring Manager & Team Lead",
        "Hiring Manager",
        "HR (Onboarding Coordinator)"
      ],
      "timeline_weeks": 8
    },
    "raw_markdown": "# Hiring Plan Report\n## Executive Summary\nThis hiring plan outlines the process to recruit **Data Analyst**. The target timeline is **8 week(s)**. The plan includes sourcing, screening, assessment, interviews, and onboarding.\n\n## Job Descriptions\n### Data Analyst\n**Summary**: Join our fast-paced startup as a Data Analyst and drive business growth through data-driven insights! As a key member of our analytics team, you'll help us make informed decisions, optimize operations, and fuel innovation. If you're passionate about using data to tell stories, we want to hear from you!\n**Key Responsibilities:**\n- Develop and maintain complex SQL queries to extract valuable insights from large datasets\n- Design and implement data visualizations using Python and BI tools like Tableau or Power BI\n- Create A/B testing frameworks to measure the impact of product changes on customer behavior\n- Collaborate with cross-functional teams to identify business opportunities and drive strategic decision-making\n- Develop and maintain dashboards to track key performance indicators (KPIs) and metrics\n- Analyze and interpret data to inform product development, marketing strategies, and operational improvements\n- Communicate complex data insights and recommendations to non-technical stakeholders through clear, actionable reporting\n- Stay up-to-date with industry trends and emerging technologies in data analysis and visualization\n**Requirements:**\n- 3+ years of experience as a Data Analyst or similar role\n- Mastery of SQL, Python programming skills, and proficiency in BI tools like Tableau or Power BI\n- Experience with A/B testing frameworks and statistical analysis techniques\n- Strong communication and collaboration skills to work effectively with cross-functional teams\n- Ability to prioritize multiple projects and meet deadlines in a fast-paced environment\n- Familiarity with cloud-based data platforms (e.g. AWS, Google Cloud) and big data technologies\n- Bachelor's degree in Computer Science, Statistics, Mathematics, or related field\n- Experience working with large datasets and implementing data governance best practices\n**Compensation:** $80k-$120k plus equity package with startup benefits (health, dental, unlimited PTO)\n**Initial Screening (ask 3-5):**\n- Can you walk me through a recent project where you applied SQL, Python, Dashboards? What was your specific impact?\n- How do you measure success in a Data Analyst role, and what metrics did you move recently?\n- Describe a challenging problem you solved using SQL. What trade-offs did you consider?\n- What does good code/analysis quality look like to you, and how do you ensure it under deadlines?\n- Tell me about a time you collaborated cross-functionally. How did you handle misalignment?\n\n\n## Hiring Process Plan\n**Timeline:** 8 weeks\n**Process Steps:**\n1. Week 1: Sourcing - Utilize social media, employee referrals, and job boards to attract top talent.  \n   *Owner: Hiring Manager*\n2. Week 2: Async Video Screening - Conduct initial video screenings using a platform like HireVue or Loom to filter candidates.  \n   *Owner: HR (Recruiting Specialist)*\n3. Week 3: Skills Assessments - Develop and send skills assessments tailored to the Data Analyst role to gauge technical abilities.  \n   *Owner: Team Lead*\n4. Week 4: Phone Interviews (Hiring Manager & Team Lead) - Shortlist top candidates for in-depth phone interviews with the Hiring Manager and Team Lead.  \n   *Owner: CEO*\n5. Week 5: In-Person Interviews - Invite top candidates for in-person interviews at the office, including a presentation task.  \n   *Owner: Hiring Manager & Team Lead*\n6. Week 6-7: Reference Checks & Offer Extension - Conduct thorough reference checks and extend offers to selected candidates.  \n   *Owner: Hiring Manager*\n7. Week 8: Onboarding - Finalize onboarding process, ensure all necessary paperwork is complete, and coordinate with IT for equipment setup.  \n   *Owner: HR (Onboarding Coordinator)*\n\n## Interview Kit\n\n## Next Steps\n- Share this plan with stakeholders for alignment.\n- Start sourcing and schedule initial screens.\n- Prepare assessments and interview materials.",
    "raw_json": {
      "extraction": {
        "company_stage": "startup",
        "timeline_weeks": 8,
        "budget_range": "competitive",
        "seniority": "mid",
        "employment_type": "full-time",
        "location": "remote",
        "key_skills": [
          "SQL",
          "Python",
          "Dashboards",
          "BI Tools",
          "A/B Testing"
        ],
        "roles": [
          "Data Analyst"
        ]
      },
      "job_descriptions": [
        {
          "title": "Data Analyst",
          "summary": "Join our fast-paced startup as a Data Analyst and drive business growth through data-driven insights! As a key member of our analytics team, you'll help us make informed decisions, optimize operations, and fuel innovation. If you're passionate about using data to tell stories, we want to hear from you!",
          "responsibilities": [
            "Develop and maintain complex SQL queries to extract valuable insights from large datasets",
            "Design and implement data visualizations using Python and BI tools like Tableau or Power BI",
            "Create A/B testing frameworks to measure the impact of product changes on customer behavior",
            "Collaborate with cross-functional teams to identify business opportunities and drive strategic decision-making",
            "Develop and maintain dashboards to track key performance indicators (KPIs) and metrics",
            "Analyze and interpret data to inform product development, marketing strategies, and operational improvements",
            "Communicate complex data insights and recommendations to non-technical stakeholders through clear, actionable reporting",
            "Stay up-to-date with industry trends and emerging technologies in data analysis and visualization"
          ],
          "requirements": [
            "3+ years of experience as a Data Analyst or similar role",
            "Mastery of SQL, Python programming skills, and proficiency in BI tools like Tableau or Power BI",
            "Experience with A/B testing frameworks and statistical analysis techniques",
            "Strong communication and collaboration skills to work effectively with cross-functional teams",
            "Ability to prioritize multiple projects and meet deadlines in a fast-paced environment",
            "Familiarity with cloud-based data platforms (e.g. AWS, Google Cloud) and big data technologies",
            "Bachelor's degree in Computer Science, Statistics, Mathematics, or related field",
            "Experience working with large datasets and implementing data governance best practices"
          ],
          "compensation_note": "$80k-$120k plus equity package with startup benefits (health, dental, unlimited PTO)"
        }
      ],
      "hiring_plan": {
        "steps": [
          "Week 1: Sourcing - Utilize social media, employee referrals, and job boards to attract top talent.",
          "Week 2: Async Video Screening - Conduct initial video screenings using a platform like HireVue or Loom to filter candidates.",
          "Week 3: Skills Assessments - Develop and send skills assessments tailored to the Data Analyst role to gauge technical abilities.",
          "Week 4: Phone Interviews (Hiring Manager & Team Lead) - Shortlist top candidates for in-depth phone interviews with the Hiring Manager and Team Lead.",
          "Week 5: In-Person Interviews - Invite top candidates for in-person interviews at the office, including a presentation task.",
          "Week 6-7: Reference Checks & Offer Extension - Conduct thorough reference checks and extend offers to selected candidates.",
          "Week 8: Onboarding - Finalize onboarding process, ensure all necessary paperwork is complete, and coordinate with IT for equipment setup."
        ],
        "owners": [
          "Hiring Manager",
          "HR (Recruiting Specialist)",
          "Team Lead",
          "CEO",
          "Hiring Manager & Team Lead",
          "Hiring Manager",
          "HR (Onboarding Coordinator)"
        ],
        "timeline_weeks": 8
      },
      "interview_kit": {
        "screening_questions": [],
        "screening_guide": [],
        "evaluation_rubric": [],
        "scorecard": [],
        "outreach_subject": "",
        "outreach_body": ""
      },
      "clarifications_asked": [],
      "timestamp": "generated"
    }
  },
  "extraction": null,
  "timestamp": "2025-09-10T18:26:26.726136"
}