{
  "session_id": "ca86fca6",
  "last_input": "refinement",
  "last_output": {
    "clarifications_asked": [],
    "jd_drafts": [
      {
        "title": "Data Analyst",
        "summary": "Join our fast-paced startup in Philadelphia as a mid-level Data Analyst, where you'll drive business growth through data-driven insights and storytelling. You'll work closely with cross-functional teams to identify areas for improvement and develop data visualizations that inform strategic decisions.",
        "responsibilities": [
          "Develop and maintain complex SQL queries to extract insights from large datasets",
          "Design and implement data visualizations using Tableau, Power BI, or other tools to communicate findings effectively",
          "Collaborate with stakeholders to identify business problems and develop recommendations for improvement",
          "Create statistical models and perform analysis to inform business decisions",
          "Develop and maintain dashboards to track key performance indicators (KPIs)",
          "Communicate complex data insights to non-technical stakeholders through clear and concise reporting",
          "Stay up-to-date with industry trends and emerging technologies, making recommendations for implementation as needed"
        ],
        "requirements": [
          "At least 1 year of experience in a data analysis role, with a focus on business acumen and communication skills",
          "Mastery of SQL, Excel, and at least one data visualization tool (Tableau or Power BI)",
          "Strong understanding of statistical concepts and ability to apply them to real-world problems",
          "Excellent communication and presentation skills, with experience communicating complex ideas to non-technical stakeholders",
          "Experience working in a fast-paced startup environment, with the ability to adapt quickly to changing priorities"
        ],
        "compensation_note": "$50k plus equity package with startup benefits (health, dental, unlimited PTO)"
      },
      {
        "title": "Business Intelligence Developer",
        "summary": "Join our dynamic startup team as a Business Intelligence Developer and help us drive data-driven decision making across the organization in Philadelphia. With a strong background in SQL, Excel, and business acumen, you'll craft compelling stories from complex data to inform strategic growth initiatives.",
        "responsibilities": [
          "Develop and maintain advanced business intelligence dashboards using Tableau, Power BI, or similar tools",
          "Collaborate with cross-functional teams to gather requirements and translate data into actionable insights",
          "Design and implement data visualization solutions that drive key business decisions",
          "Analyze complex data sets using statistical analysis techniques to identify trends and patterns",
          "Develop and maintain reports, dashboards, and data visualizations to support strategic growth initiatives",
          "Communicate findings and recommendations effectively to non-technical stakeholders",
          "Stay up-to-date with industry trends and best practices in business intelligence and data visualization",
          "Contribute to the development of our data culture by identifying areas for improvement and implementing new processes",
          "Travel occasionally within Philadelphia to collaborate with teams"
        ],
        "requirements": [
          "1 year experience as a Business Intelligence Developer or similar role",
          "Proven expertise in SQL, Excel, Tableau, Power BI, or similar tools",
          "Strong business acumen with ability to understand organizational goals and objectives",
          "Excellent communication and presentation skills to effectively share insights with stakeholders",
          "Experience with data visualization principles and techniques to create compelling stories from complex data",
          "Ability to work in a fast-paced environment with multiple priorities and deadlines",
          "Familiarity with statistical analysis techniques (e.g. regression, forecasting)",
          "Certifications in Tableau or Power BI a plus"
        ],
        "compensation_note": "$50k"
      }
    ],
    "hiring_plan": {
      "steps": [
        "Week 1-2: Sourcing - Utilize LinkedIn, job boards, and employee referrals to find top candidates",
        "Week 3: Screening - Conduct async video screenings using tools like Calendly or Loom to reduce no-shows and save time",
        "Week 4: Skills Assessment - Send relevant skills assessments (e.g., data analysis challenges) to top performers from screening",
        "Week 5: Interviews - Schedule in-person or remote interviews with the team lead and hiring manager for both roles",
        "Week 6-7: Reference Checks - Conduct thorough reference checks via email or phone calls to verify candidate claims",
        "Week 8: Offer & Onboarding - Extend job offers, finalize details, and plan an onboarding process for new hires"
      ],
      "owners": [
        "Hiring Manager",
        "HR",
        "Team Lead (Data)",
        "Team Lead (Business Intelligence)",
        "CEO/Founder",
        "Hiring Manager"
      ],
      "timeline_weeks": 8
    },
    "raw_markdown": "# Hiring Plan Report\n## Executive Summary\nThis hiring plan outlines the process to recruit **Data Analyst, Business Intelligence Developer**. The target timeline is **8 week(s)**. The plan includes sourcing, screening, assessment, interviews, and onboarding.\n\n## Job Descriptions\n### Data Analyst\n#### Summary\nJoin our fast-paced startup as a mid-level Data Analyst, where you'll drive business growth through data-driven insights and storytelling. You'll work closely with cross-functional teams to identify areas for improvement and develop data visualizations that inform strategic decisions.\n#### Key Responsibilities\n- Develop and maintain complex SQL queries to extract insights from large datasets\n- Design and implement data visualizations using Tableau, Power BI, or other tools to communicate findings effectively\n- Collaborate with stakeholders to identify business problems and develop recommendations for improvement\n- Create statistical models and perform analysis to inform business decisions\n- Develop and maintain dashboards to track key performance indicators (KPIs)\n- Communicate complex data insights to non-technical stakeholders through clear and concise reporting\n- Stay up-to-date with industry trends and emerging technologies, making recommendations for implementation as needed\n#### Requirements\n- 3+ years of experience in a data analysis role, with a focus on business acumen and communication skills\n- Mastery of SQL, Excel, and at least one data visualization tool (Tableau or Power BI)\n- Strong understanding of statistical concepts and ability to apply them to real-world problems\n- Excellent communication and presentation skills, with experience communicating complex ideas to non-technical stakeholders\n- Experience working in a fast-paced startup environment, with the ability to adapt quickly to changing priorities\n- Bachelor's degree in Computer Science, Mathematics, Statistics, or related field\n- Certification in data analysis tools (e.g. Google Data Analytics Certification) is a plus\n**Compensation:** $120k plus equity package with startup benefits (health, dental, unlimited PTO)\n\n### Business Intelligence Developer\n#### Summary\nJoin our dynamic startup team as a Business Intelligence Developer and help us drive data-driven decision making across the organization. With a strong background in SQL, Excel, and business acumen, you'll craft compelling stories from complex data to inform strategic growth initiatives.\n#### Key Responsibilities\n- Develop and maintain advanced business intelligence dashboards using Tableau, Power BI, or similar tools\n- Collaborate with cross-functional teams to gather requirements and translate data into actionable insights\n- Design and implement data visualization solutions that drive key business decisions\n- Analyze complex data sets using statistical analysis techniques to identify trends and patterns\n- Develop and maintain reports, dashboards, and data visualizations to support strategic growth initiatives\n- Communicate findings and recommendations effectively to non-technical stakeholders\n- Stay up-to-date with industry trends and best practices in business intelligence and data visualization\n- Contribute to the development of our data culture by identifying areas for improvement and implementing new processes\n#### Requirements\n- 3+ years experience as a Business Intelligence Developer or similar role\n- Proven expertise in SQL, Excel, Tableau, Power BI, or similar tools\n- Strong business acumen with ability to understand organizational goals and objectives\n- Excellent communication and presentation skills to effectively share insights with stakeholders\n- Experience with data visualization principles and techniques to create compelling stories from complex data\n- Ability to work in a fast-paced environment with multiple priorities and deadlines\n- Familiarity with statistical analysis techniques (e.g. regression, forecasting)\n- Certifications in Tableau or Power BI a plus\n**Compensation:** $120k plus equity package with startup benefits (health, dental, unlimited PTO)\n\n\n## Hiring Process Plan\n**Timeline:** 8 weeks\n**Process Steps:**\n1. Week 1-2: Sourcing - Utilize LinkedIn, job boards, and employee referrals to find top candidates  \n   *Owner: Hiring Manager*\n2. Week 3: Screening - Conduct async video screenings using tools like Calendly or Loom to reduce no-shows and save time  \n   *Owner: HR*\n3. Week 4: Skills Assessment - Send relevant skills assessments (e.g., data analysis challenges) to top performers from screening  \n   *Owner: Team Lead (Data)*\n4. Week 5: Interviews - Schedule in-person or remote interviews with the team lead and hiring manager for both roles  \n   *Owner: Team Lead (Business Intelligence)*\n5. Week 6-7: Reference Checks - Conduct thorough reference checks via email or phone calls to verify candidate claims  \n   *Owner: CEO/Founder*\n6. Week 8: Offer & Onboarding - Extend job offers, finalize details, and plan an onboarding process for new hires  \n   *Owner: Hiring Manager*\n\n## Interview Kit\n**Screening Questions:**\n- Can you walk me through a recent project where you applied SQL, Excel, Tableau? What was your specific impact?\n- How do you measure success in this role, and what metrics did you move recently?\n- Describe a challenging problem you solved using SQL. What trade-offs did you consider?\n- What does good code/analysis quality look like to you, and how do you ensure it under deadlines?\n- Tell me about a time you collaborated cross-functionally. How did you handle misalignment?\n**Evaluation Rubric:**\n- Technical depth\n- Problem solving\n- Communication\n- Ownership & initiative\n- Collaboration & culture add\n**Scorecard Fields:**\n- Technical Depth (1-5)\n- Problem Solving (1-5)\n- Communication (1-5)\n- Culture Add (1-5)\n- Overall Recommendation\n- Notes\n\n## Next Steps\n- Share this plan with stakeholders for alignment.\n- Start sourcing and schedule initial screens.\n- Prepare assessments and interview materials.",
    "raw_json": {
      "extraction": {
        "company_stage": "startup",
        "timeline_weeks": 8,
        "budget_range": "$120k",
        "seniority": "mid",
        "employment_type": "full-time",
        "location": "remote",
        "key_skills": [
          "SQL",
          "Excel",
          "Tableau",
          "Power BI",
          "Data Visualization",
          "Business Acumen",
          "Statistical Analysis",
          "Data Storytelling",
          "Communication Skills"
        ],
        "roles": [
          "Data Analyst",
          "Business Intelligence Developer"
        ]
      },
      "job_descriptions": [
        {
          "title": "Data Analyst",
          "summary": "Join our fast-paced startup in Philadelphia as a mid-level Data Analyst, where you'll drive business growth through data-driven insights and storytelling. You'll work closely with cross-functional teams to identify areas for improvement and develop data visualizations that inform strategic decisions.",
          "responsibilities": [
            "Develop and maintain complex SQL queries to extract insights from large datasets",
            "Design and implement data visualizations using Tableau, Power BI, or other tools to communicate findings effectively",
            "Collaborate with stakeholders to identify business problems and develop recommendations for improvement",
            "Create statistical models and perform analysis to inform business decisions",
            "Develop and maintain dashboards to track key performance indicators (KPIs)",
            "Communicate complex data insights to non-technical stakeholders through clear and concise reporting",
            "Stay up-to-date with industry trends and emerging technologies, making recommendations for implementation as needed"
          ],
          "requirements": [
            "At least 1 year of experience in a data analysis role, with a focus on business acumen and communication skills",
            "Mastery of SQL, Excel, and at least one data visualization tool (Tableau or Power BI)",
            "Strong understanding of statistical concepts and ability to apply them to real-world problems",
            "Excellent communication and presentation skills, with experience communicating complex ideas to non-technical stakeholders",
            "Experience working in a fast-paced startup environment, with the ability to adapt quickly to changing priorities"
          ],
          "compensation_note": "$50k plus equity package with startup benefits (health, dental, unlimited PTO)"
        },
        {
          "title": "Business Intelligence Developer",
          "summary": "Join our dynamic startup team as a Business Intelligence Developer and help us drive data-driven decision making across the organization in Philadelphia. With a strong background in SQL, Excel, and business acumen, you'll craft compelling stories from complex data to inform strategic growth initiatives.",
          "responsibilities": [
            "Develop and maintain advanced business intelligence dashboards using Tableau, Power BI, or similar tools",
            "Collaborate with cross-functional teams to gather requirements and translate data into actionable insights",
            "Design and implement data visualization solutions that drive key business decisions",
            "Analyze complex data sets using statistical analysis techniques to identify trends and patterns",
            "Develop and maintain reports, dashboards, and data visualizations to support strategic growth initiatives",
            "Communicate findings and recommendations effectively to non-technical stakeholders",
            "Stay up-to-date with industry trends and best practices in business intelligence and data visualization",
            "Contribute to the development of our data culture by identifying areas for improvement and implementing new processes",
            "Travel occasionally within Philadelphia to collaborate with teams"
          ],
          "requirements": [
            "1 year experience as a Business Intelligence Developer or similar role",
            "Proven expertise in SQL, Excel, Tableau, Power BI, or similar tools",
            "Strong business acumen with ability to understand organizational goals and objectives",
            "Excellent communication and presentation skills to effectively share insights with stakeholders",
            "Experience with data visualization principles and techniques to create compelling stories from complex data",
            "Ability to work in a fast-paced environment with multiple priorities and deadlines",
            "Familiarity with statistical analysis techniques (e.g. regression, forecasting)",
            "Certifications in Tableau or Power BI a plus"
          ],
          "compensation_note": "$50k"
        }
      ],
      "hiring_plan": {
        "steps": [
          "Week 1-2: Sourcing - Utilize LinkedIn, job boards, and employee referrals to find top candidates",
          "Week 3: Screening - Conduct async video screenings using tools like Calendly or Loom to reduce no-shows and save time",
          "Week 4: Skills Assessment - Send relevant skills assessments (e.g., data analysis challenges) to top performers from screening",
          "Week 5: Interviews - Schedule in-person or remote interviews with the team lead and hiring manager for both roles",
          "Week 6-7: Reference Checks - Conduct thorough reference checks via email or phone calls to verify candidate claims",
          "Week 8: Offer & Onboarding - Extend job offers, finalize details, and plan an onboarding process for new hires"
        ],
        "owners": [
          "Hiring Manager",
          "HR",
          "Team Lead (Data)",
          "Team Lead (Business Intelligence)",
          "CEO/Founder",
          "Hiring Manager"
        ],
        "timeline_weeks": 8
      },
      "interview_kit": {
        "screening_questions": [
          "Can you walk me through a recent project where you applied SQL, Excel, Tableau? What was your specific impact?",
          "How do you measure success in this role, and what metrics did you move recently?",
          "Describe a challenging problem you solved using SQL. What trade-offs did you consider?",
          "What does good code/analysis quality look like to you, and how do you ensure it under deadlines?",
          "Tell me about a time you collaborated cross-functionally. How did you handle misalignment?"
        ],
        "screening_guide": [
          {
            "question": "Describe a recent project and your specific impact.",
            "what_to_evaluate": "Clarity, ownership, measurable outcomes"
          },
          {
            "question": "Walk me through a tough technical decision.",
            "what_to_evaluate": "Trade-offs, reasoning, stakeholder alignment"
          }
        ],
        "evaluation_rubric": [
          "Technical depth",
          "Problem solving",
          "Communication",
          "Ownership & initiative",
          "Collaboration & culture add"
        ],
        "scorecard": [
          "Technical Depth (1-5)",
          "Problem Solving (1-5)",
          "Communication (1-5)",
          "Culture Add (1-5)",
          "Overall Recommendation",
          "Notes"
        ],
        "outreach_subject": "",
        "outreach_body": ""
      },
      "clarifications_asked": [],
      "timestamp": "generated"
    }
  },
  "extraction": null,
  "timestamp": "2025-09-11T17:39:39.659107"
}