{
  "session_id": "d7bc0866",
  "last_input": "refinement",
  "last_output": {
    "clarifications_asked": [],
    "jd_drafts": [
      {
        "title": "Data",
        "summary": "Join our high-growth startup in Boston as a mid-level Data Expert, where you'll drive data-driven decision-making and fuel our mission to revolutionize [industry/field]. You'll be part of a tight-knit team that's passionate about delivering impact and growth. If you're a data enthusiast with a hunger for innovation, we'd love to hear from you!",
        "responsibilities": [
          "Develop and maintain advanced analytics capabilities to inform strategic business decisions",
          "Design and implement data pipelines, ETL processes, and data visualizations to support key initiatives",
          "Collaborate with cross-functional teams to identify areas of improvement and drive process automation",
          "Stay up-to-date on industry trends and emerging technologies to recommend new approaches and tools",
          "Develop and maintain data quality and governance best practices to ensure high-quality insights",
          "Create and manage dashboards, reports, and other visualizations to communicate complex data insights",
          "Identify and implement opportunities for process optimization and efficiency gains"
        ],
        "requirements": [
          "Bachelor's degree in Computer Science, Mathematics, Statistics, or related field",
          "1+ years of experience in a similar role with a focus on data analysis and interpretation",
          "Proficiency in programming languages such as Python, SQL, or R",
          "Experience with cloud platforms like GCP and AWS",
          "Strong understanding of statistical concepts and modeling techniques"
        ],
        "compensation_note": "$60,000 salary plus equity package with startup benefits (health, dental, unlimited PTO)"
      }
    ],
    "hiring_plan": {
      "steps": [
        "Weeks 1-2: Sourcing - Utilize LinkedIn Ads, Employee Referrals, and Professional Networks to attract top Data talent",
        "Weeks 2-3: Async Video Screening - Use platforms like HireVue or Luma to conduct initial video interviews and filter candidates",
        "Weeks 4-5: Skills Assessments - Develop customized coding challenges or data-related tasks to evaluate technical skills",
        "Weeks 5-6: Interviews - Conduct in-person or virtual interviews with the Hiring Manager, Team Lead, and other relevant stakeholders",
        "Week 7: Reference Checks - Verify candidate references and background check (if necessary)",
        "Week 8: Offer & Onboarding - Extend job offer, finalize onboarding process, and ensure a smooth transition"
      ],
      "owners": [
        "Hiring Manager",
        "HR Representative",
        "Team Lead",
        "CEO/Founder",
        "HR Representative",
        "Hiring Manager"
      ],
      "timeline_weeks": 8
    },
    "raw_markdown": "# Hiring Plan Report\n## Executive Summary\nThis hiring plan outlines the process to recruit **Data**. The target timeline is **8 week(s)**. The plan includes sourcing, screening, assessment, interviews, and onboarding.\n\n## Job Descriptions\n### Data\n#### Summary\nJoin our high-growth startup as a mid-level Data Expert, where you'll drive data-driven decision-making and fuel our mission to revolutionize [industry/field]. You'll be part of a tight-knit team that's passionate about delivering impact and growth. If you're a data enthusiast with a hunger for innovation, we'd love to hear from you!\n#### Key Responsibilities\n- Develop and maintain advanced analytics capabilities to inform strategic business decisions\n- Design and implement data pipelines, ETL processes, and data visualizations to support key initiatives\n- Collaborate with cross-functional teams to identify areas of improvement and drive process automation\n- Stay up-to-date on industry trends and emerging technologies to recommend new approaches and tools\n- Develop and maintain data quality and governance best practices to ensure high-quality insights\n- Create and manage dashboards, reports, and other visualizations to communicate complex data insights\n- Identify and implement opportunities for process optimization and efficiency gains\n#### Requirements\n- Bachelor's degree in Computer Science, Mathematics, Statistics, or related field\n- 3+ years of experience in a similar role, with a focus on data analysis and interpretation\n- Proficiency in programming languages such as Python, SQL, or R\n- Experience with data visualization tools like Tableau, Power BI, or D3.js\n- Strong understanding of statistical concepts and modeling techniques\n- Excellent communication and collaboration skills to work effectively with stakeholders\n- Ability to analyze complex data sets and communicate insights clearly and concisely\n**Compensation:** Competitive salary plus equity package with startup benefits (health, dental, unlimited PTO)\n\n\n## Hiring Process Plan\n**Timeline:** 8 weeks\n**Process Steps:**\n1. Weeks 1-2: Sourcing - Utilize LinkedIn Ads, Employee Referrals, and Professional Networks to attract top Data talent  \n   *Owner: Hiring Manager*\n2. Weeks 2-3: Async Video Screening - Use platforms like HireVue or Luma to conduct initial video interviews and filter candidates  \n   *Owner: HR Representative*\n3. Weeks 4-5: Skills Assessments - Develop customized coding challenges or data-related tasks to evaluate technical skills  \n   *Owner: Team Lead*\n4. Weeks 5-6: Interviews - Conduct in-person or virtual interviews with the Hiring Manager, Team Lead, and other relevant stakeholders  \n   *Owner: CEO/Founder*\n5. Week 7: Reference Checks - Verify candidate references and background check (if necessary)  \n   *Owner: HR Representative*\n6. Week 8: Offer & Onboarding - Extend job offer, finalize onboarding process, and ensure a smooth transition  \n   *Owner: Hiring Manager*\n\n## Interview Kit\n**Screening Questions:**\n- Can you walk me through a recent project where you applied the core skills for this role? What was your specific impact?\n- How do you measure success in this role, and what metrics did you move recently?\n- Describe a challenging problem you solved using your primary skill. What trade-offs did you consider?\n- What does good code/analysis quality look like to you, and how do you ensure it under deadlines?\n- Tell me about a time you collaborated cross-functionally. How did you handle misalignment?\n**Evaluation Rubric:**\n- Technical depth\n- Problem solving\n- Communication\n- Ownership & initiative\n- Collaboration & culture add\n**Scorecard Fields:**\n- Technical Depth (1-5)\n- Problem Solving (1-5)\n- Communication (1-5)\n- Culture Add (1-5)\n- Overall Recommendation\n- Notes\n\n## Next Steps\n- Share this plan with stakeholders for alignment.\n- Start sourcing and schedule initial screens.\n- Prepare assessments and interview materials.",
    "raw_json": {
      "extraction": {
        "company_stage": "startup",
        "timeline_weeks": 8,
        "budget_range": "competitive",
        "seniority": "mid",
        "employment_type": "full-time",
        "location": "remote",
        "key_skills": [],
        "roles": [
          "Data"
        ]
      },
      "job_descriptions": [
        {
          "title": "Data",
          "summary": "Join our high-growth startup in Boston as a mid-level Data Expert, where you'll drive data-driven decision-making and fuel our mission to revolutionize [industry/field]. You'll be part of a tight-knit team that's passionate about delivering impact and growth. If you're a data enthusiast with a hunger for innovation, we'd love to hear from you!",
          "responsibilities": [
            "Develop and maintain advanced analytics capabilities to inform strategic business decisions",
            "Design and implement data pipelines, ETL processes, and data visualizations to support key initiatives",
            "Collaborate with cross-functional teams to identify areas of improvement and drive process automation",
            "Stay up-to-date on industry trends and emerging technologies to recommend new approaches and tools",
            "Develop and maintain data quality and governance best practices to ensure high-quality insights",
            "Create and manage dashboards, reports, and other visualizations to communicate complex data insights",
            "Identify and implement opportunities for process optimization and efficiency gains"
          ],
          "requirements": [
            "Bachelor's degree in Computer Science, Mathematics, Statistics, or related field",
            "1+ years of experience in a similar role with a focus on data analysis and interpretation",
            "Proficiency in programming languages such as Python, SQL, or R",
            "Experience with cloud platforms like GCP and AWS",
            "Strong understanding of statistical concepts and modeling techniques"
          ],
          "compensation_note": "$60,000 salary plus equity package with startup benefits (health, dental, unlimited PTO)"
        }
      ],
      "hiring_plan": {
        "steps": [
          "Weeks 1-2: Sourcing - Utilize LinkedIn Ads, Employee Referrals, and Professional Networks to attract top Data talent",
          "Weeks 2-3: Async Video Screening - Use platforms like HireVue or Luma to conduct initial video interviews and filter candidates",
          "Weeks 4-5: Skills Assessments - Develop customized coding challenges or data-related tasks to evaluate technical skills",
          "Weeks 5-6: Interviews - Conduct in-person or virtual interviews with the Hiring Manager, Team Lead, and other relevant stakeholders",
          "Week 7: Reference Checks - Verify candidate references and background check (if necessary)",
          "Week 8: Offer & Onboarding - Extend job offer, finalize onboarding process, and ensure a smooth transition"
        ],
        "owners": [
          "Hiring Manager",
          "HR Representative",
          "Team Lead",
          "CEO/Founder",
          "HR Representative",
          "Hiring Manager"
        ],
        "timeline_weeks": 8
      },
      "interview_kit": {
        "screening_questions": [
          "Can you walk me through a recent project where you applied the core skills for this role? What was your specific impact?",
          "How do you measure success in this role, and what metrics did you move recently?",
          "Describe a challenging problem you solved using your primary skill. What trade-offs did you consider?",
          "What does good code/analysis quality look like to you, and how do you ensure it under deadlines?",
          "Tell me about a time you collaborated cross-functionally. How did you handle misalignment?"
        ],
        "screening_guide": [
          {
            "question": "Describe a recent project and your specific impact.",
            "what_to_evaluate": "Clarity, ownership, measurable outcomes"
          },
          {
            "question": "Walk me through a tough technical decision.",
            "what_to_evaluate": "Trade-offs, reasoning, stakeholder alignment"
          }
        ],
        "evaluation_rubric": [
          "Technical depth",
          "Problem solving",
          "Communication",
          "Ownership & initiative",
          "Collaboration & culture add"
        ],
        "scorecard": [
          "Technical Depth (1-5)",
          "Problem Solving (1-5)",
          "Communication (1-5)",
          "Culture Add (1-5)",
          "Overall Recommendation",
          "Notes"
        ],
        "outreach_subject": "",
        "outreach_body": ""
      },
      "clarifications_asked": [],
      "timestamp": "generated"
    }
  },
  "extraction": null,
  "timestamp": "2025-09-11T15:17:37.048768"
}